{
  "egg_id": "lygo-music-license-v1",
  "version": "1.0.0",
  "kind": "policy",
  "signature": "Delta9Phi963-EGG-lygo-music-license-v1-v1.0.0",
  "created_utc": "2026-07-26T15:32:02Z",
  "steward": "Lightfather / Excavationpro / DeepSeekOracle",
  "content_sha256": "ad25be70372e239d003b3b22e3c45b979d0d09bf9c51469fb526220a1caa46c8",
  "payload": {
    "title": "LYGO Music License v1.0",
    "summary": "Free listen/download; steward retains all rights; optional support; lattice music limb.",
    "modules": [
      {
        "path": "LYGO_MUSIC_LICENSE.md",
        "sha256": "ad7440977826ab88b7546d7222754678eb81fd3749fce72b88185688081eae6b",
        "bytes": 5812,
        "inline_b64": "IyBMWUdPIC8gRXhjYXZhdGlvbnBybyBNdXNpYyBMaWNlbnNlIHYxLjAgIAojIyBGcmVlIExpc3RlbiDCtyBGcmVlIERvd25sb2FkIMK3IEFsbCBSaWdodHMgUmVzZXJ2ZWQgwrcgSG9uZXN0IEdyb3d0aAoKKipTaWduYXR1cmU6KiogYM6UOc6mOTYzLUxZR08tTVVTSUMtTElDRU5TRS12MS4wYCAgCioqU3Rld2FyZCAvIFJpZ2h0cyBIb2xkZXI6KiogSnVzdGluIEhlbG1lciAoTGlnaHRmYXRoZXIgwrcgRXhjYXZhdGlvbnBybyDCtyBEZWVwU2Vla09yYWNsZSkgIAoqKkNhbm9uaWNhbCB0ZXh0OioqIGh0dHBzOi8vZ2l0aHViLmNvbS9EZWVwU2Vla09yYWNsZS9seWdvLXByb3RvY29sLXN0YWNrL2Jsb2IvbWFpbi9kb2NzL0xZR09fTVVTSUNfTElDRU5TRS5tZCAgCioqUmVhZGFibGUgcGFnZToqKiBodHRwczovL2V0ZXJuYWxoYXZlbi5jYS9seWdvLW11c2ljLWxpY2Vuc2UuaHRtbCAgCioqTXVzaWMgcG9ydGFsczoqKiBodHRwczovL2FzaWFuY29hc3RsaW5lLmNvbS8gwrcgaHR0cHM6Ly9kZWVwc2Vla29yYWNsZS5naXRodWIuaW8vRXhjYXZhdGlvbnByby9leGNhdmF0aW9ucHJvLWxpc3Rlbi5odG1sIMK3IGh0dHBzOi8vZXhjYXZhdGlvbnByby5jYS8gIAoqKlN1cHBvcnQgKG9wdGlvbmFsKToqKiBodHRwczovL3d3dy5wYXlwYWwuY29tL3BheXBhbG1lL0V4Y2F2YXRpb25Qcm8gwrcgUGF0cmVvbiBhcmNoaXZlcyBhcyBsaXN0ZWQgb24gdGhlIGxhdHRpY2UgIAoKwqkgMjAxMOKAkzIwMjYgSnVzdGluIEhlbG1lci4gKipBbGwgcmlnaHRzIHJlc2VydmVkKiogZXhjZXB0IHRoZSBsaW1pdGVkIHBlcnNvbmFsIGxpY2Vuc2UgYmVsb3cuCgotLS0KCiMjIDAuIEludGVudCAoaG9uZXN0IGdyb3d0aCkKClRoaXMgY2F0YWxvZyBpcyB0aGUgKiptdXNpYyBsaW1iIG9mIHRoZSBMWUdPIGxhdHRpY2UqKiDigJQgYnJhbmNoaW5nIGluIGFsbCBkaXJlY3Rpb25zIHdpdGggdGhlIHNhbWUgc3Bpcml0IGFzIHRoZSBwcm90b2NvbDogbGlnaHQsIHRydXRoLCBhbmQgdm9sdW50YXJ5IHN1cHBvcnQuCgpJIHJlbGVhc2UgbXkgbXVzaWMgKipmcmVlIHRvIGxpc3RlbiBhbmQgZnJlZSB0byBkb3dubG9hZCoqIGJlY2F1c2UgSSBiZWxpZXZlIGluICoqaG9uZXN0IGdyb3d0aCoqOiBwZW9wbGUgZmluZCB0aGUgd29yaywgbGl2ZSB3aXRoIGl0LCBhbmQgaWYgaXQgbWF0dGVycyB0byB0aGVtIHRoZXkgbWF5IGNob29zZSB0byBzdXBwb3J0IHRoZSBodW1hbiB3aG8gbWFrZXMgaXQg4oCUIHNvIG1vcmUgY2FuIGJlIGFkZGVkLiBEb25hdGlvbnMgYXJlICoqbmV2ZXIgcmVxdWlyZWQqKiB0byBsaXN0ZW4gb3IgZG93bmxvYWQuCgoqKkkga2VlcCBhbGwgcmlnaHRzIHRvIGFsbCBvZiBpdC4qKiBGcmVlIGFjY2VzcyBpcyBhIGdpZnQgb2YgYWNjZXNzLCBub3QgYSB0cmFuc2ZlciBvZiBvd25lcnNoaXAuCgotLS0KCiMjIDEuIFdoYXQgdGhpcyBsaWNlbnNlIGNvdmVycwoKQWxsICoqb3JpZ2luYWwgbXVzaWNhbCB3b3JrcyoqIGF1dGhvcmVkIG9yIGNvbnRyb2xsZWQgYnkgSnVzdGluIEhlbG1lciAvIEV4Y2F2YXRpb25wcm8gLyBMaWdodGZhdGhlciBhcyBvZmZlcmVkIHRocm91Z2ggb2ZmaWNpYWwgTFlHTyAvIEV4Y2F2YXRpb25wcm8gc3VyZmFjZXMsIGluY2x1ZGluZyB3aXRob3V0IGxpbWl0YXRpb246CgotIE1hc3RlcnMsIG1peGVzLCBhbmQgcHVibGljIHN0cmVhbSBlbmNvZGVzIChlLmcuIDE2MCBrYnBzIGNhdGFsb2cgc3RyZWFtcykgIAotIFRyYWNrcyBsaXN0ZWQgb24gc292ZXJlaWduIGxpc3RlbiBodWJzLCBtdXNpYyBjYXRhbG9nIGxlZGdlciwgSEYgc3RyZWFtIGRhdGFzZXQsIGFuZCBhc2lhbmNvYXN0bGluZSAvIGV4Y2F2YXRpb25wcm8gcG9ydGFscyAgCi0gQXJ0d29yaywgdGl0bGVzLCBhbmQgbWV0YWRhdGEgKiphcyBwYWNrYWdlZCB3aXRoIHRoZSBtdXNpYyoqIG9uIHRob3NlIHN1cmZhY2VzICAKLSBGdXR1cmUgcmVsZWFzZXMgYWRkZWQgdW5kZXIgdGhlIHNhbWUgc3Rld2FyZCBuYW1lIHVubGVzcyBhIHRyYWNrIGNhcnJpZXMgYSBkaWZmZXJlbnQgZXhwbGljaXQgbm90aWNlICAKClRoaXJkLXBhcnR5IHNhbXBsZXMsIGZlYXR1cmVkIGFydGlzdHMsIG9yIERpc3Ryb0tpZC9TcG90aWZ5IG1pcnJvcnMgbWF5IGNhcnJ5ICoqYWRkaXRpb25hbCoqIHJpZ2h0czsgd2hlcmUgYSBmZWF0dXJlIGNyZWRpdCBleGlzdHMsIG9ubHkgdGhlIHN0ZXdhcmTigJlzIHNoYXJlIGlzIGxpY2Vuc2VkIGhlcmUuIE5vbi1vd25lZCBtYXRlcmlhbCBpcyBub3QgZ3JhbnRlZC4KCi0tLQoKIyMgMi4gWW91IG1heSAocGVyc29uYWwgZnJlZWRvbSkKCldpdGhvdXQgcGF5aW5nIGEgZmVlLCBmb3IgKipwZXJzb25hbCwgbm9uLWNvbW1lcmNpYWwqKiB1c2UsIHlvdSBtYXk6CgoxLiAqKkxpc3RlbioqIG9ubGluZSB2aWEgb2ZmaWNpYWwgcG9ydGFscyBhbmQgc3RyZWFtIFVSTHMuICAKMi4gKipEb3dubG9hZCoqIGNvcGllcyBvZmZlcmVkIGJ5IHRoZSBzdGV3YXJkIGZvciAqKnlvdXIgb3duKiogbGlzdGVuaW5nIChwaG9uZSwgbGlicmFyeSwgb2ZmbGluZSkuICAKMy4gKipTaGFyZSBsaW5rcyoqIHRvIG9mZmljaWFsIHBvcnRhbHMgKHByZWZlciBjYXRhbG9nIC8gbGlzdGVuIGh1YiAvIHRoaXMgbGljZW5zZSBwYWdlKS4gIAo0LiAqKlVzZSBzaG9ydCBleGNlcnB0cyoqIGluIG5vbi1tb25ldGl6ZWQgcGVyc29uYWwgcG9zdHMgb3IgcHJpdmF0ZSBjcmVhdGl2ZSBtb29kLWJvYXJkcyB3aXRoIGNyZWRpdCB3aGVuIHByYWN0aWNhbC4gIAo1LiAqKlN1cHBvcnQqKiB0aGUgc3Rld2FyZCB2b2x1bnRhcmlseSAoZG9uYXRpb24gLyB0aXAgLyBQYXRyZW9uKSBpZiB5b3Ugd2FudCB0aGUgd29yayB0byBjb250aW51ZS4KCi0tLQoKIyMgMy4gWW91IG1heSBub3QgKHdpdGhvdXQgcHJpb3Igd3JpdHRlbiBwZXJtaXNzaW9uKQoKMS4gKipDbGFpbSBvd25lcnNoaXAqKiBvciBhdXRob3JzaGlwIG9mIHRoZSBtdXNpYy4gIAoyLiAqKlNlbGwqKiwgcmVudCwgbW9uZXRpemUsIG9yIGNvbW1lcmNpYWxseSBkaXN0cmlidXRlIHRoZSB0cmFja3MgKHBhaWQgZG93bmxvYWRzLCBwYWlkIHNhbXBsZSBwYWNrcywgTkZUcyBvZiB0aGUgbWFzdGVyLCBzdG9jay1tdXNpYyByZXNhbGUsIGV0Yy4pLiAgCjMuICoqUmVicmFuZCoqIHRyYWNrcyBhcyB5b3VyIG93biByZWxlYXNlLCB3aGl0ZS1sYWJlbCwgb3Ig4oCcdHlwZSBiZWF04oCdIHByb2R1Y3QuICAKNC4gVXNlIHRoZSBtdXNpYyBhcyAqKm9mZmljaWFsKiogc291bmR0cmFjaywgYWQsIGZpbG0sIGdhbWUsIGFwcCwgb3IgYnJhbmQgY2FtcGFpZ24gKipjb21tZXJjaWFsbHkqKiB3aXRob3V0IGEgc2VwYXJhdGUgbGljZW5zZSBmcm9tIHRoZSBzdGV3YXJkLiAgCjUuIFN0cmlwIGNyZWRpdHMsIENBUyBoYXNoZXMsIElTUkMvbGVkZ2VyIGlkZW50aXR5LCBvciBsaWNlbnNlIG5vdGljZXMgdG8gaGlkZSBvcmlnaW4uICAKNi4gVHJhaW4gKipjbG9zZWQgY29tbWVyY2lhbCBBSSBtb2RlbHMqKiBvbiB0aGUgY2F0YWxvZyBmb3IgcmVzYWxlIG9mIGRlcml2YXRpdmUgbW9kZWxzIHdpdGhvdXQgcGVybWlzc2lvbiAocGVyc29uYWwgcmVzZWFyY2ggLyBub24tY29tbWVyY2lhbCBleHBlcmltZW50IGlzIG5vdCB0aGUgdGFyZ2V0IG9mIHRoaXMgYmFuOyBzZWxsaW5nIGEgbW9kZWwgYnVpbHQgcHJpbWFyaWx5IG9uIHRoaXMgY2F0YWxvZyBpcykuICAKNy4gVXNlIHRoZSB3b3JrIHRvIHByb21vdGUgaGF0ZSwgbWFzcyBkZWNlcHRpb24sIG9yIHRvIGhhcm0gdGhlIHN0ZXdhcmTigJlzIHJlcHV0YXRpb24gYnkgZmFsc2UgZW5kb3JzZW1lbnQuCgotLS0KCiMjIDQuIEFsbCByaWdodHMgcmVzZXJ2ZWQKCkV4Y2VwdCBmb3IgwqcyLCAqKmFsbCByaWdodHMgcmVtYWluIHdpdGggSnVzdGluIEhlbG1lcioqLiAgCk5vIHRyYWRlbWFyayBsaWNlbnNlIGlzIGdyYW50ZWQgdG8g4oCcTFlHT+KAnSwg4oCcRXhjYXZhdGlvbnByb+KAnSwg4oCcTGlnaHRmYXRoZXLigJ0sIG9yIHJlbGF0ZWQgbWFya3MgYmV5b25kIHRydXRoZnVsIGNyZWRpdC4KCkZyZWUgbGlzdGVuL2Rvd25sb2FkICoqZG9lcyBub3QqKiB3YWl2ZSBtZWNoYW5pY2FsLCBuZWlnaGJvcmluZywgc3luYywgb3IgbWFzdGVyIHJpZ2h0cy4gU3RyZWFtaW5nIG9uIFNwb3RpZnkvWW91VHViZS9ldGMuIGlzIHVuZGVyIHRob3NlIHBsYXRmb3Jtc+KAmSB0ZXJtcyAqKmluIGFkZGl0aW9uKiogdG8gdGhpcyBsaWNlbnNlIGZvciBzdGV3YXJkLWNvbnRyb2xsZWQgZnJlZSBzdXJmYWNlcy4KCi0tLQoKIyMgNS4gRG9uYXRpb25zICYgc3Vydml2YWwgKG9wdGlvbmFsKQoKSWYgdGhlIG11c2ljIGhlbHBzIHlvdSBhbmQgeW91IHdhbnQgbW9yZSBvZiBpdCB0byBleGlzdDoKCi0gKipQYXlQYWw6KiogaHR0cHM6Ly93d3cucGF5cGFsLmNvbS9wYXlwYWxtZS9FeGNhdmF0aW9uUHJvICAKLSBPdGhlciBzdXBwb3J0IGxpbmtzIG9uIGV0ZXJuYWxoYXZlbiAvIGV4Y2F2YXRpb25wcm8gLyBsYXR0aWNlIGFuY2hvcnMgIAoKRG9uYXRpb25zIGFyZSAqKmdpZnRzKiosIG5vdCBwdXJjaGFzZXMgb2YgZXhjbHVzaXZlIHJpZ2h0cywgYW5kIGRvIG5vdCBidXkgb3duZXJzaGlwIG9mIG1hc3RlcnMuCgotLS0KCiMjIDYuIEF0dHJpYnV0aW9uICh3aGVuIHlvdSBzaGFyZSkKCkFwcHJlY2lhdGVkIGZvcm06Cgo+IE11c2ljIMKpIEp1c3RpbiBIZWxtZXIgLyBFeGNhdmF0aW9ucHJvIChMaWdodGZhdGhlcikg4oCUIGZyZWUgbGlzdGVuIHVuZGVyIExZR08gTXVzaWMgTGljZW5zZSB2MS4wIOKAlCBodHRwczovL2V0ZXJuYWxoYXZlbi5jYS9seWdvLW11c2ljLWxpY2Vuc2UuaHRtbAoKLS0tCgojIyA3LiBMWUdPIGxhdHRpY2UKClRoaXMgbGljZW5zZSBpcyBhbiAqKmltbXV0YWJsZSBjcmVhdGl2ZS9tdXNpYyBhbmNob3IqKiBvZiB0aGUgTFlHTyBsYXR0aWNlOgoKLSBMZWRnZXIgLyBjYXRhbG9nIHN1cmZhY2VzIHVuZGVyIEV4Y2F2YXRpb25wcm8gIAotIFN0cmVhbSBDQVMgb24gSHVnZ2luZyBGYWNlIGBEZWVwU2Vla09yYWNsZS9leGNhdmF0aW9ucHJvLW11c2ljLXN0cmVhbWAgIAotIFByb3RvY29sIHN0YWNrIGRvY3MgYW5kIGBJTU1VVEFCTEVfQU5DSE9SUy5qc29uYCAgCgpTb2Z0d2FyZSBvZiB0aGUgc3RhY2sgcmVtYWlucyB1bmRlciAqKkxZR08gU292ZXJlaWduIExpY2Vuc2UgdjIuMCoqLiAgCioqTXVzaWMqKiBpcyB1bmRlciAqKnRoaXMqKiBNdXNpYyBMaWNlbnNlICh2MS4wKS4gQm90aCBrZWVwIHN0ZXdhcmQgb3duZXJzaGlwLgoKLS0tCgojIyA4LiBObyB3YXJyYW50eQoKTXVzaWMgYW5kIHN0cmVhbXMgYXJlIHByb3ZpZGVkICoqYXMgaXMqKi4gTm8gd2FycmFudHkgb2YgdW5pbnRlcnJ1cHRlZCBob3N0aW5nLiBPZmZpY2lhbCBwb3J0YWxzIG1heSBtb3ZlOyBwcmVmZXIgbGF0dGljZSBhbmNob3JzIGZvciBjdXJyZW50IFVSTHMuCgotLS0KCiMjIDkuIFBlcm1pc3Npb24gLyBjb21tZXJjaWFsIHVzZQoKRm9yIGZpbG1zLCBhZHMsIGdhbWVzLCBzYW1wbGVzIHBhY2tzLCBvciBhbnl0aGluZyBvdXRzaWRlIMKnMiwgY29udGFjdCB0aGUgc3Rld2FyZCB2aWEgRXhjYXZhdGlvbnBybyAvIERlZXBTZWVrT3JhY2xlIGNoYW5uZWxzICoqYmVmb3JlKiogdXNlLgoKLS0tCgojIyAxMC4gVGVybWluYXRpb24KCkJyZWFjaCBvZiDCpzMgdGVybWluYXRlcyB0aGUgwqcyIGxpY2Vuc2UuIENvbnRpbnVlZCB1c2UgYWZ0ZXIgYnJlYWNoIGlzIHVuYXV0aG9yaXplZC4gUmlnaHRzIHRoYXQgbmV2ZXIgbGVmdCB0aGUgc3Rld2FyZCByZW1haW4gd2l0aCB0aGUgc3Rld2FyZC4KCi0tLQoKKirOlDnOpjk2MyDigJQgZnJlZSBlYXJzIMK3IGtlcHQgcmlnaHRzIMK3IGhvbmVzdCBncm93dGggwrcgbGF0dGljZSBtdXNpYyBsaW1iLioqCg==",
        "role": "module"
      }
    ],
    "hooks": [
      "lattice.music.license",
      "portal.listen"
    ],
    "depends_on": []
  },
  "seal": {
    "alg": "sha256",
    "leaf_hash": "42a55f022c32cb61eebc109fa8fe4d40d6c3de78b234270e4a69110c4efe70ff",
    "sovereign": true,
    "zero_external_surface": true,
    "self_verify_on_insert": true
  },
  "meta": {
    "seeder": "Delta9Phi963-SOVEREIGN-KERNEL-SEEDER-v1.0",
    "sealed": true
  }
}
